title,pubDate,link
b'Brexit One Year Later: Markets Might Get It Wrong Again',"b'Fri, 23 Jun 2017 07:15:31 EDT'",b'https://www.wsj.com/articles/brexit-one-year-later-markets-might-get-it-wrong-again-1498207558?mod=rss_markets_main'
"b""BlackBerry's Valuation Got Disconnected""","b'Fri, 23 Jun 2017 13:54:44 EDT'",b'https://www.wsj.com/articles/blackberrys-valuation-got-disconnected-1498239620?mod=rss_markets_main'
"b'For Consumers, Less Debt but Lots of Bills'","b'Fri, 23 Jun 2017 08:52:17 EDT'",b'https://www.wsj.com/articles/for-consumers-less-debt-but-lots-of-bills-1498210201?mod=rss_markets_main'
"b""Weibo Gets in Beijing's Way""","b'Fri, 23 Jun 2017 06:01:14 EDT'",b'https://www.wsj.com/articles/weibo-gets-in-beijings-way-1498211891?mod=rss_markets_main'
"b'A New Risk for Goldman, Morgan Stanley in Stress Tests'","b'Thu, 22 Jun 2017 17:30:44 EDT'",b'https://www.wsj.com/articles/a-new-risk-for-goldman-morgan-stanley-in-stress-tests-1498166656?mod=rss_markets_main'
"b""China's Debt Crackdown Could Get Out of Hand""","b'Fri, 23 Jun 2017 03:53:08 EDT'",b'https://www.wsj.com/articles/chinas-debt-crackdown-could-get-out-of-hand-1498204384?mod=rss_markets_main'
"b""'Immaterial' Revision or Not, Hain Still has Problems""","b'Thu, 22 Jun 2017 16:23:12 EDT'",b'https://www.wsj.com/articles/immaterial-revision-or-not-hain-still-has-problems-1498162172?mod=rss_markets_main'
b'A Risky Bet By Investors---That the Health-Care Bill Fails',"b'Thu, 22 Jun 2017 17:10:10 EDT'",b'https://www.wsj.com/articles/a-risky-bet-by-investorsthat-the-health-care-bill-fails-1498153065?mod=rss_markets_main'
b'Uber: Too Big to Flail',"b'Thu, 22 Jun 2017 12:21:21 EDT'",b'https://www.wsj.com/articles/uber-too-big-to-flail-1498142510?mod=rss_markets_main'
